2019-12-18 09:31:25,followlastma,,1,2,2,,,#GMSpeaks,1207231884717113344,https://twitter.com/followlastma/status/1207231884717113344,"""For the festive season, I will like to implore road users not to park their vehicles within 30m of any junction. If they violate this, the vehicles will be towed away and they will pay for it."""
2019-12-18 09:29:40,followlastma,,1,0,0,,,#GMSpeaks,1207231446810791936,https://twitter.com/followlastma/status/1207231446810791936,"""This is not about working against the people but they're working for their selfish interest. In my position, I expect to hear from the public with information about the errant officer who will be dealt with."""
2019-12-18 09:19:05,followlastma,,3,0,1,,,#GMSpeaks,1207228780688871424,https://twitter.com/followlastma/status/1207228780688871424,"""These commercial bus drivers are very unruly. Sometimes, there is the fear factor of what they can do to officers. We lost two officers recently while trying to enforce."""
2019-12-18 09:17:16,followlastma,,3,0,1,,,#GMSpeaks,1207228324965167104,https://twitter.com/followlastma/status/1207228324965167104,"""The people are really the problem. Most of us are self-centered. Most passengers will willingly join a bus that is ready to flout traffic rules. Arresting these buses come from two angles - they abuse you or beg you."""
2019-12-18 09:13:48,followlastma,,1,0,0,,,#GMSpeaks,1207227451010699264,https://twitter.com/followlastma/status/1207227451010699264,"""I think all the Ministries and Agencies know their jobs. The fact is that since there are so many bad roads, you need to prioritize."""
2019-12-18 09:12:06,followlastma,,1,0,0,,,#GMSpeaks,1207227025116848133,https://twitter.com/followlastma/status/1207227025116848133,"""We are a part of the government. We do have a working relationship with agencies in charge of fixing roads. We must know that there will be heavy traffic while roads are being fixed."""
2019-12-18 08:19:44,followlastma,,2,2,6,,@TVCconnect,#YourViewTVC #GMSpeaks,1207213844868796418,https://twitter.com/followlastma/status/1207213844868796418,"Join our GM, Jide Oduyoye, on with Morayo on at 9.30am this morning."
2019-12-17 17:36:54,followlastma,,0,0,0,,@trafficbutter,,1206991673756147714,https://twitter.com/followlastma/status/1206991673756147714,Fagba inw St Kizito is gtg St Kizito inw lonlo b/stop is a moving traffic Lonlo b/st inw Ishaga roundabout is gtg
2019-12-17 17:36:53,followlastma,,1,0,0,,@trafficbutter,,1206991670430048256,https://twitter.com/followlastma/status/1206991670430048256,In/out of odejobi is a moving traffic Odejobi junction inw pen cinema is gtg RJ pen cinema inw Eterna is gtg Eterna inw Nubi avenue is busy Nubi Ave inw college Road junc is gtg College Rd junc inw Fagba is busy
2019-12-17 17:36:52,followlastma,,1,1,2,,@trafficbutter,#LASTMAREPORT #,1206991664922935297,https://twitter.com/followlastma/status/1206991664922935297,06:35PM. #*Iju Ishaga* Ishaga roundabout inw Fagba is gtg Approaching fagba intersection is a moving traffic due to alternation Fagba inw holy Mary Church is gtg Holy Mary Church inw odejobi junction is busy
2019-12-17 16:48:48,followlastma,,0,0,0,,@trafficbutter,,1206979567732318209,https://twitter.com/followlastma/status/1206979567732318209,Adebola House inw /out of welfare is a moving traffic Adebola House inw Oshoppe is gtg Oshoppe inw first Bank is also good First bank inw Allen roundabout is busy.
2019-12-17 16:48:47,followlastma,,1,0,0,,@trafficbutter,,1206979564599156736,https://twitter.com/followlastma/status/1206979564599156736,Salvation all the way to sheraton is gtg RJ sheraton inw westown is gtg Westown approaching Opebi U-turn to cakes and cream is a moving traffic Cakes&cream inw salvation is busy Salvation inw Adebola House is a moving traffic
2019-12-17 16:48:46,followlastma,,1,0,0,,@trafficbutter,#LASTMAREPORT #IKEJA #Allen,1206979560522354688,https://twitter.com/followlastma/status/1206979560522354688,06:47PM. avenue inw toyin roundabout is gtg In and out of toyin is also gtg Toyin roundabout inw Chrisland sch is gtg Chrisland inw Adebola House is busy Adebola House inw salvation is a moving traffic
2019-12-17 16:47:17,followlastma,,0,0,0,,@trafficbutter,,1206979185723531264,https://twitter.com/followlastma/status/1206979185723531264,Boladale inw Toyota is ok. Return journey is gud frm Toyota inw Anthony Oke. Anthony Oke inw Bertola connecting Ikorodu road is gud. Anthony Oke inw Gbagada is gud.
2019-12-17 16:47:16,followlastma,,1,0,0,,@trafficbutter,,1206979182351339520,https://twitter.com/followlastma/status/1206979182351339520,"Hotel Newcastle inw Anthony Village is slow. It is busy on Anthony Oke,bt slow descending the bridge inw Oshodi by Heritage Garden. Heritage Garden inw Boadale is slightly busy."
2019-12-17 16:47:15,followlastma,,1,0,1,,@trafficbutter,#LASTMAREPORT #GBAGADA,1206979178047975426,https://twitter.com/followlastma/status/1206979178047975426,"05:45PM. /APAPA OSHODI EXPRESSWAY: It is busy frm Iyana Oworo inw Y junction,bt gud ascending onto the bridge inw Gbagada. It is a gud movement coming frm Carwash inw Gnagada. Gbagada inw Anthony is ok."
2019-12-17 16:24:32,followlastma,,0,2,1,,@trafficbutter,,1206973460175556613,https://twitter.com/followlastma/status/1206973460175556613,Ballet inw ijesha is gd both on service lane and the main carriage way Inner part of ireAkari to isolo is gtg Apata inw transformer to ilasa is gd in&out Agopalace way inw Apple junction is OK in&out
2019-12-17 16:24:31,followlastma,,1,1,2,,@trafficbutter,#LASTMAREPORT #Okota,1206973456799191040,https://twitter.com/followlastma/status/1206973456799191040,"05:23PM. /isolo Celexpress inw Ago is a moving traffic while the RJ is OK Cele link bridge inw iyanaitire is gd Chemist inw pako is gd in&out OkeAfa inw kogberegbe,Aye,limca to laspotech is a moving traffic"
2019-12-17 16:11:18,followlastma,,0,1,1,,@trafficbutter,,1206970131735359489,https://twitter.com/followlastma/status/1206970131735359489,"Ogudu inw Alapere by Oando is slow. Oando inw Apostolic is steady,little respite inbtwn Apostolic nd Ojota Interchange. It is busy on the Interchange Ikosi junction. Ikosi junction inw Kara is ok. Return journey is gud all thru."
2019-12-17 16:11:17,followlastma,,1,3,2,,@trafficbutter,#LASTMAREPORT #TMB,1206970128128184323,https://twitter.com/followlastma/status/1206970128128184323,"05:10PM. /LAGOS IBADAN EXPRESSWAY: Obalende inw Ilubirin is Busy. Ilubirin inw Adeniji is steady. Adeniji inw UNILAG Waterfront is ok,bt busy shortly after inw Iyana Oworo/Carwash nd Ifako. Ifako inw Ogudu is steady."
2019-12-17 16:01:39,followlastma,,0,1,0,,@trafficbutter,,1206967703761833985,https://twitter.com/followlastma/status/1206967703761833985,Casso inw kola is busy bt gd inw moshalashi and alakuko(slw approachn alakuko) Gd inw amje bt busy inw ajegunle dwn to tollgate
2019-12-17 16:01:37,followlastma,,1,1,0,,@trafficbutter,,1206967694903394315,https://twitter.com/followlastma/status/1206967694903394315,Slw approachn abule taylor bt gd inw General/ahmadiyya/obadeyi and ijaiye(quite slw at ijaiye) Connectn meiran inw salolo is gd bt slw inw adura and Casso
2019-12-17 16:01:36,followlastma,,1,0,0,,@trafficbutter,,1206967689719230471,https://twitter.com/followlastma/status/1206967689719230471,*LAG ABK CONT* Iyana-Ipaja inw all d way to pleasure and ileepo is gd(slw at ileepo) Gd inw super and abule egba(slw ascending jubilee bridge) Gd descendn into awori uturn
2019-12-17 15:51:42,followlastma,,1,1,1,,@trafficbutter,,1206965197681889282,https://twitter.com/followlastma/status/1206965197681889282,Connecting adealu/araromi/Iyana-Ipaja is gd(bstop delays/pedestrian crossing at Iyana-Ipaja ubridge)
2019-12-17 15:51:41,followlastma,,1,1,1,,@trafficbutter,,1206965195240886274,https://twitter.com/followlastma/status/1206965195240886274,Gd inw PWD bt it gets busy from PWD turning inw airport/national and ikj along Connectn ajayi farm/ilezik/mongoro/cement is gd(busy approachn onilekere) It’s busy from aluminum village inw dopemu ubridge
2019-12-17 15:51:40,followlastma,,1,0,0,,@trafficbutter,,1206965192497778694,https://twitter.com/followlastma/status/1206965192497778694,Onw mvmnt inw challenge dwn to vono is all gd It gets busy approachn ilupeju(alt) It’s good inw cappa and oshodi ubridge(slw at oshodi ubridge) Bstop activities at oshodi makes it busy inw bolade bt better inw ladipo and shogunle
2019-12-17 15:51:39,followlastma,,1,2,4,,@trafficbutter,#LASTMAREPORT #,1206965187938533379,https://twitter.com/followlastma/status/1206965187938533379,04:50PM. #*LAG ABK EXPRESSWAY * It’s a gd mvmnt from empire inw idioro It gets busy inw olosha bt gd inw regina mundi It’s busy inw ojuwoye and mushin Slw inw AP and smooth inw olorunsogo Busy inw palm ave
2019-12-17 15:30:20,followlastma,,0,1,0,,@trafficbutter,,1206959821003640832,https://twitter.com/followlastma/status/1206959821003640832,RJ Oba akran inw GH is very busy GH in/out oba akinjobi is gtg GH inw Country club is gtg Country club inw cantonment is gtg Cantonment inw maryland is busy.
2019-12-17 15:30:19,followlastma,,1,2,1,,@trafficbutter,,1206959818721972225,https://twitter.com/followlastma/status/1206959818721972225,Cantonment inw nitel is a moving traffic Nitel all the way to gen hospital ubridge is very busy GH inw local Airport is also busy RJ Airport inw GH is is a moving traffic GH inw kodesho is good Kodesho inw oba akran is a moving traffic
2019-12-17 15:30:18,followlastma,,1,3,2,,@trafficbutter,#LASTMAREPORT #,1206959814737321984,https://twitter.com/followlastma/status/1206959814737321984,04:27PM. #*Maryland* Maryland inw odo iyalaro is good RJ frm odo iyalaro inw maryland is busy Maryland inw Anthony is gtg RJ Anthony inw maryland is a moving traffic Maryland inw cantonment is gtg
2019-12-17 07:15:37,followlastma,,0,0,1,,@trafficbutter @TrafficChiefNG,,1206835322560102400,https://twitter.com/followlastma/status/1206835322560102400,"OkeAfa inw pako,college,Aye,limca to laspotech is a moving traffic in&out due to Aswani market Inner part of ireAkari to osolo is gtg Ballet inw ijesha is OK both on service lane and main carriage way Apata inw transformer to ilasa is gd"
2019-12-17 07:15:36,followlastma,,1,3,1,,@trafficbutter @TrafficChiefNG,#LASTMAREPORT #Okota,1206835319754182656,https://twitter.com/followlastma/status/1206835319754182656,08:15AM. /isolo Celexpress inw okota to AgoR/A is gtg in&out Cele link bridge inw iyanaitire is fine Ago palace way inw AppleJunction is OK in&out Chemist inw pako is a moving traffic while the RJ is gd
2019-12-17 06:53:44,followlastma,,0,1,1,,@trafficbutter @TrafficChiefNG,,1206829813526339585,https://twitter.com/followlastma/status/1206829813526339585,Gd inw akin adesola(slw approachn adeola odeku jnctn) Gd inw tiamiyu savage jnctn RJ back to 3MB is gd Connecting olopomeji is gd busy from ifako inw ogudu(a lifeless body on the road; SEHMU already contacted) Smooth back to Berger and kara
2019-12-17 06:53:43,followlastma,,1,1,2,,@trafficbutter @TrafficChiefNG,,1206829810435182592,https://twitter.com/followlastma/status/1206829810435182592,Ifako inw olopomeji/iyana oworo is gd It gets busy from unilag WF inw makoko/adekunle/adeniji Gd inw dolphin by busy on Osborne rd Gd inw alfred rewane(busy approachn ikoyi club) Gd inw falomo bt busy inw law sch
2019-12-17 06:53:42,followlastma,,1,1,3,,@trafficbutter @TrafficChiefNG,#LASTMAREPORT #,1206829807851446272,https://twitter.com/followlastma/status/1206829807851446272,07:50AM. #*LAGOS IBADAN/3MB/IKOYI* Gd Mvmnt from opic inw kara dwn to Berger Connecting otedola bridge/secretariat/motorways/tollgate/ojota bridge/China town/alapere/ogudu is gd(slw at ogudu)
2019-12-17 06:33:50,followlastma,,0,1,0,,@trafficbutter @TrafficChiefNG,,1206824808438272000,https://twitter.com/followlastma/status/1206824808438272000,Gd inw olosha(busy approachn olosha/regina mundi /ojuwoye Gd inw olorunsogo/vono/ilupeju Busy approachn cappa bt gd inw oshodi ubridge
2019-12-17 06:33:50,followlastma,,1,1,0,,@trafficbutter @TrafficChiefNG,,1206824805560934400,https://twitter.com/followlastma/status/1206824805560934400,It’s busy from mushin but gd inw olosha/idioro/moshalashi/empire is all gd RJ from empire dwn to idioro is gd(slw at idioro)
2019-12-17 06:33:49,followlastma,,1,1,0,,@trafficbutter @TrafficChiefNG,#LASTMAREPORT #,1206824803073765381,https://twitter.com/followlastma/status/1206824803073765381,07:32AM. #*MUSHIN AXIS * It’s a busy mvmnt at oshodi ubridge bt gd inw cappa/Coca-Cola/vono/challenge It’s busy approachn palm ave jnctn bt gd inw olorunsogo/AP/mushin
2019-12-17 06:22:16,followlastma,,0,2,2,,@trafficbutter @TrafficChiefNG,,1206821896966328321,https://twitter.com/followlastma/status/1206821896966328321,Busy approachn mongoro dwn to ilezik/ajayi farm/ikj along/national/airport turning is on the high side It’s better inw PWD/shogunle/ladipo/bolade(busy at bolade inw oshodi ubridge) RJ back to Iyana-Ipaja is all gd
2019-12-17 06:22:15,followlastma,,1,2,2,,@trafficbutter @TrafficChiefNG,,1206821893493444609,https://twitter.com/followlastma/status/1206821893493444609,Gd inw super bt busy inw carwash and iyana ipaja(bstop activities/pedestrian crossing) Onw Mvmnt to araromi/adealu/pako is all gd It’s busy approachn dopemu ubridge bt gd inw cement
2019-12-17 06:22:14,followlastma,,1,1,1,,@trafficbutter @TrafficChiefNG,,1206821890221850630,https://twitter.com/followlastma/status/1206821890221850630,Onw Mvmnt to meiran/ijaiye/Obadeyi is gd(busy at obadeyi) Gd inw ahmadiyya/General/awori/abule egba is gd(busy ubridge inw charity) Gd inw super bt busy app ileepo
2019-12-17 06:22:14,followlastma,,4,4,7,,@trafficbutter @TrafficChiefNG,#LASTMAREPORT #LAGOS,1206821887147413505,https://twitter.com/followlastma/status/1206821887147413505,07:18AM. -ABEOKUTA EXPWAY It’s a busy mvmnt at sango by gd inw amje(slw approachn amje) Connecting alakuko and moshalashi is gd bt it’s busy inw kola Gd inw kola/Adura a d salolo(slw approachn salolo)
2019-12-17 05:53:49,followlastma,,0,0,0,,@trafficbutter @TrafficChiefNG,,1206814736895135744,https://twitter.com/followlastma/status/1206814736895135744,Sheraton inw Kingsway is a moving traffic Kingsway inw Cantonment is GTG Cantonment inw Maryland is a moving traffic.
2019-12-17 05:53:48,followlastma,,1,0,0,,@trafficbutter @TrafficChiefNG,,1206814734143696896,https://twitter.com/followlastma/status/1206814734143696896,"GH inw/out Oba Akinjobi is good GH inw Kodesoh,down to Oba akran is GTG RJ frm Oba akran inw Kodesoh is a moving traffic Kodesoh inw GH is busy GH inw Sheraton is GTG"
2019-12-17 05:53:48,followlastma,,1,1,1,,@trafficbutter @TrafficChiefNG,#LASTMAREPORT #,1206814732008804353,https://twitter.com/followlastma/status/1206814732008804353,"06:52AM. #*Maryland* Movements inw/out odo iyalaro is good, also inw/out Anthony is also good Maryland all the way down to General hospital is a Jolly ride GH inw LocalAirport is busy LocalAirport inw GH is GTG"
2019-12-16 20:04:47,followlastma,,0,0,0,,,,1206666502100934656,https://twitter.com/followlastma/status/1206666502100934656,Vehicle has been completely towed away from the road. Movement much better now.
2019-12-16 18:54:51,followlastma,cokaranwolu,0,0,1,,,,1206648904592297985,https://twitter.com/followlastma/status/1206648904592297985,You're very welcome. The fire is out. Movement will get better gradually.
2019-12-16 18:53:37,followlastma,followlastma,0,2,3,,@LAG_FireService @rrslagos767,,1206648591588216833,https://twitter.com/followlastma/status/1206648591588216833,and were very responsive to this. Well done guys! Our officers also fully on ground to manage the traffic situation. Please be patient. 
2019-12-16 18:50:14,followlastma,,1,2,3,,@TrafficChiefNG @Gidi_Traffic @trafficbutter @lagostelevision @lagostraffic961,#Update,1206647738781319184,https://twitter.com/followlastma/status/1206647738781319184,The fire has been put out and vehicles now able to move on the lane available beside the tanker while effort is being made for complete evacuation.
2019-12-16 18:42:16,followlastma,,1,0,2,,@TrafficChiefNG @Gidi_Traffic @trafficbutter @lagostraffic961,,1206645735783096321,https://twitter.com/followlastma/status/1206645735783096321,Traffic from Adekunle to IyanaOworo is very busy. IyanaOworo to carwash is ok. Carwash inw Alapere to the scene of the impediment is very busy as vehicles cannot move ahead. Also busy from Odoyalaro to the Interchange.
2019-12-16 18:42:14,followlastma,,2,0,2,,@TrafficChiefNG @Gidi_Traffic @trafficbutter @lagostraffic961,#OjotaBridge #lastmareports,1206645727784517632,https://twitter.com/followlastma/status/1206645727784517632,[7.25pm] Burning diesel tanker on OjotaBridge inw Tollgate afecting traffic movement coming from Alapere towards Tollgate as well as those coming from Ojota towards the Interchange.
2019-12-16 17:55:46,followlastma,,0,0,0,,@TrafficChiefNG @Gidi_Traffic @trafficbutter @lagostelevision @lagostraffic961,,1206634032055902208,https://twitter.com/followlastma/status/1206634032055902208,IndependenceTunnel to Odoyalaro bridge is busy due to activities of men of TaskForce on at Odoyalaro. Steady flow inw Ojota to the Interchange.
2019-12-16 17:55:45,followlastma,,1,0,0,,@TrafficChiefNG @Gidi_Traffic @trafficbutter @lagostelevision @lagostraffic961,,1206634029979713536,https://twitter.com/followlastma/status/1206634029979713536,"Obanikoro to Savoil is slow. Steady to Anthony. Anthony to Idiroko is slow, then steady to IndependenceTunnel."
2019-12-16 17:55:45,followlastma,,1,0,0,,@TrafficChiefNG @Gidi_Traffic @trafficbutter @lagostelevision @lagostraffic961,,1206634028046176256,https://twitter.com/followlastma/status/1206634028046176256,Movement inw Shitta axis is slow. Alaka inw Stadium Bridge inw Barracks is good but slow at Barrcks. Barracks inw Ojuelegba to DormanLong bridge is good. DormanLong inw Fadeyi to Obanikoro is good.
2019-12-16 17:55:44,followlastma,,1,0,0,,@TrafficChiefNG @Gidi_Traffic @trafficbutter @lagostelevision @lagostraffic961,,1206634026104164352,https://twitter.com/followlastma/status/1206634026104164352,"Movement inw Iponri to Alaka service lane is good. EkoBridge inw Alaka man carriageway is slow. Better movement after descending the bridge, busy inw Stadium UBridge du eto traffic alternation."
2019-12-16 17:55:44,followlastma,,1,0,1,,@TrafficChiefNG @Gidi_Traffic @trafficbutter @lagostelevision @lagostraffic961,#IkoroduRd #PMTrafficReviews,1206634024149622784,https://twitter.com/followlastma/status/1206634024149622784,"[6.51pm] CMS inw Apongbon to OfinCanal is still busy. Better inw IjoraOlopa to EkoBridge. EkoBridge inw Costain r/a is ok, though slow at the r/a."
2019-12-16 17:27:01,followlastma,,0,1,0,,@TrafficChiefNG @Gidi_Traffic @trafficbutter @lagostelevision @lagostraffic961,,1206626800081801217,https://twitter.com/followlastma/status/1206626800081801217,Good movement inw Otedola to Berger. Slow at Berger due to heavy traffic connecting Berger UBridge. Berger inw Kara is good.
2019-12-16 17:27:01,followlastma,,1,1,0,,@TrafficChiefNG @Gidi_Traffic @trafficbutter @lagostelevision @lagostraffic961,,1206626797305188357,https://twitter.com/followlastma/status/1206626797305188357,"After the impediment to Unilag Waterfront is steady. Movement inw IyanaOworo to Ogudu is busy. Steady inw Alapere, good to OjotaBridge. Slow movement exiting OjotaBridge to Ikosi jxn is busy."
2019-12-16 17:26:59,followlastma,,1,0,0,,@TrafficChiefNG @Gidi_Traffic @trafficbutter @lagostelevision @lagostraffic961,,1206626792242585601,https://twitter.com/followlastma/status/1206626792242585601,Very busy from Glover through OsborneRd to Ilubirin. Obalende inw Ilubirin is also busy. Ilubirin inw Adeniji to Adekunle is steady. Slow movement after Adekunle due to a brokendown truck.
2019-12-16 17:26:59,followlastma,,1,2,1,,@TrafficChiefNG @Gidi_Traffic @trafficbutter @lagostelevision @lagostraffic961,#Ikoyi #3MB #LagosIbadanExp,1206626790229397511,https://twitter.com/followlastma/status/1206626790229397511,"[6.20pm] AkinAdesola inw FalomoBridge is ok. CivicCentre inw RampBridge is good, though slow connecting FalomoBridge. FalomoBridge inw AlfredRewane is steady to Glover jxn."
2019-12-16 17:00:16,followlastma,,0,1,0,,@TrafficChiefNG @Gidi_Traffic @trafficbutter @lagostelevision @lagostraffic961,,1206620064759373824,https://twitter.com/followlastma/status/1206620064759373824,RJ Marwa inw Lekki r/a to the Tollplaza is ok. Tollplaza to LawSchool is good. A bit slow at LawSchool. Good movement inw Oniru b/stop. Approaching Oniru down to BonnyCamp.
2019-12-16 17:00:15,followlastma,,1,2,1,,@TrafficChiefNG @Gidi_Traffic @trafficbutter @lagostelevision @lagostraffic961,,1206620062246932480,https://twitter.com/followlastma/status/1206620062246932480,BonnyCamp inw OzumbaMbadiwe is busy down to Sandfill. Steady movement to the Tollplaza. Better movement inw Lekki r/a to Marwa.
2019-12-16 17:00:14,followlastma,,1,0,0,,@TrafficChiefNG @Gidi_Traffic @trafficbutter @lagostelevision @lagostraffic961,,1206620060279816193,https://twitter.com/followlastma/status/1206620060279816193,EkoHotel r/a inw EkoHotel gate is slow. Better movement down to Adrao. Adrao to AdeolaOdeku jxn is slow. Better movement to OpenUniversity but slow inw BonnyCamp to McWen.
2019-12-16 17:00:14,followlastma,,1,0,0,,@TrafficChiefNG @Gidi_Traffic @trafficbutter @lagostelevision @lagostraffic961,,1206620058279141376,https://twitter.com/followlastma/status/1206620058279141376,"AjoseAdeogun to EkoHotel r/a is good. EkoHotel r/a in/out AdetokunboAdemola is good, only slow at the r/a. EkoHotel r/a inw SanusiFafunwa is slow to AdeolaHopewell jxn but better to AkinAdesola."
2019-12-16 17:00:13,followlastma,,1,0,0,,@TrafficChiefNG @Gidi_Traffic @trafficbutter @lagostelevision @lagostraffic961,,1206620055867400192,https://twitter.com/followlastma/status/1206620055867400192,Oceanview to EkoHotel r/a is busy. EkoHotel r/a inw AjoseAdeogun to LigaliAyorinde is good. LigaliAyorinde to WaterCorporation is steady. RJ through LigaliAyorinde to AjoseAdeogun is ok.
2019-12-16 17:00:13,followlastma,,1,1,1,,@TrafficChiefNG @Gidi_Traffic @trafficbutter @lagostelevision @lagostraffic961,#VI #PMTrafficUpdates,1206620053845815296,https://twitter.com/followlastma/status/1206620053845815296,[5.57pm] McWen inw BonnyCamp is steady. BoonyCamp inw AhmaduBelloWay is good to Legico. Legico to AdeolaOdeku jxn is slow. Movement down to Oceanview is good.
2019-12-16 16:37:34,followlastma,,0,2,1,,@TrafficChiefNG @Gidi_Traffic @trafficbutter @lagostraffic961pic,#FunshoWilliamsAv #lastmareports,1206614352125661185,https://twitter.com/followlastma/status/1206614352125661185,[5.22pm] Brokendown tanker having mechanical fault at Area C inw DormanLong bridge enroute Fadeyi. Effort being made for its removal. Officers on ground managing traffic situation.
2019-12-16 16:29:43,followlastma,,1,1,0,,@TrafficChiefNG @Gidi_Traffic @trafficbutter @lagostelevision @lagostraffic961,,1206612380387565568,https://twitter.com/followlastma/status/1206612380387565568,Allen inw Aromire is busy in/out. Coca-Cola inw Mobil is good. Mobil inw Cadbury is a slow moving traffic. Acme inw Wemco is ok but busy on the RJ. Wemco inw Omole jxn is heavy.
2019-12-16 16:29:43,followlastma,,1,3,2,,@TrafficChiefNG @Gidi_Traffic @trafficbutter @lagostelevision @lagostraffic961,#Ikeja #PMTrafficUpdates,1206612378202316800,https://twitter.com/followlastma/status/1206612378202316800,[5.20pm] Barracks inw Coca-Cola is busy. Coca-Cola inw Radio is busy. Radio inw Allen is busy. Allen inw Balogun jxn is good but while approaching Ikeja UBridge is heavy.
2019-12-16 16:22:10,followlastma,,0,1,0,,@TrafficChiefNG @Gidi_Traffic @trafficbutter @lagostelevision @lagostraffic961,,1206610480380469249,https://twitter.com/followlastma/status/1206610480380469249,DormanLong inw Fadeyi to Idiroko is very good. Idiroko down to the Interchange is busy.
2019-12-16 16:22:10,followlastma,,1,1,1,,@TrafficChiefNG @Gidi_Traffic @trafficbutter @lagostelevision @lagostraffic961,,1206610478308495360,https://twitter.com/followlastma/status/1206610478308495360,"Steady flow inw StadiumBridge, good to Barracks though a bit slow at Barracks b/stop. Better movement inw Ojuelegba to DormanLong bridge."
2019-12-16 16:22:09,followlastma,,1,0,0,,@TrafficChiefNG @Gidi_Traffic @trafficbutter @lagostelevision @lagostraffic961,,1206610475850641409,https://twitter.com/followlastma/status/1206610475850641409,EkoBridge descending to Costain r/a is ok but slow at the r/a. Costain inw Iponri to Alaka service lane is good. EkoBridge inw Alaka main carriageway is ok but slow descending the bridge.
2019-12-16 16:22:09,followlastma,,1,0,0,,@TrafficChiefNG @Gidi_Traffic @trafficbutter @lagostelevision @lagostraffic961,,1206610473531138049,https://twitter.com/followlastma/status/1206610473531138049,UBA r/a inw Apongbon service lane is slow. BroadStr connecting Apongbon service lane is also slow. Movement beyond OfinCanal towards IjoraOlopa to EkoBridge is very good.
2019-12-16 16:22:08,followlastma,,1,2,2,,@TrafficChiefNG @Gidi_Traffic @trafficbutter @lagostraffic961,#IkoroduRd #PMTrafficUpdates,1206610471270453250,https://twitter.com/followlastma/status/1206610471270453250,[5.18pm] Movement from Mcwen and StateHouse inw CMS is good. Movement inw Apongbon to OfinCanal is busy. CMS descending to UBA r/a is steady. UBA r/a inw InnerMarina is steady.
2019-12-16 16:03:42,followlastma,,0,2,0,,@TrafficChiefNG @Gidi_Traffic @trafficbutter @lagostelevision @lagostraffic961,,1206605832605097986,https://twitter.com/followlastma/status/1206605832605097986,Good movement inw Tollgate to Otedola. Otedola inw Berger is steady. Slow at Berger due to traffic connecting Berger UBridge. Berger inw Kara is good. RJ is GTG entirely.
