0,1,2,3,4,5,6,7,8,9,10,11
2020-01-18 07:23:09,followlastma,,1,6,5,,@TrafficChiefNG @Gidi_Traffic @trafficbutterpic,#OjotaInterchange #lastmareports,1218433631305203712,https://twitter.com/followlastma/status/1218433631305203712,[7.55am] A truck loaded with plywood tilted and spilling some of the products on the road ascending the Interchange towards Tollgate. One lane still moving while efforts being made for evacuation.
2020-01-17 16:44:52,followlastma,,0,1,0,,,,1218212604319059969,https://twitter.com/followlastma/status/1218212604319059969,"As motorists leave the Market and ascend the Eko Bridge, traffic is Gd to approaching the Costain Ramp where it gets a bit slow, then better to Costain R/About."
2020-01-17 16:44:50,followlastma,,1,2,3,,,#VI #EkoBridge,1218212592843460608,https://twitter.com/followlastma/status/1218212592843460608,"[5:43PM] Law School INW Ozumba Mbadiwe is Gd up to Radisson Blu where it gets slow all the way to Bony Camp INW the Mc Wen Bridge. From McWen Bridge, traffic is Gd to CMS Ramp in the Bridge, then it gets slow from there all the way to Apongbon INW the Market."
2020-01-17 16:24:18,followlastma,,0,1,1,,,#Ifako,1218207425465143296,https://twitter.com/followlastma/status/1218207425465143296,".... Leaving Oworo, traffic is steady INW Ifake, Ogudu and then better to Alapere, Apostolic and Ojota Bridge."
2020-01-17 16:24:17,followlastma,,1,2,3,,,#Ikoyi #3MB,1218207423258931204,https://twitter.com/followlastma/status/1218207423258931204,"Leaving Bayo Kuku to Osborne is slow all the way thru Osborne to Ilubirin, then better traffic INW Adeniji, Adekunle and Unilag Water-Front as well as Oworo. ..."
2020-01-17 16:18:38,followlastma,,0,0,1,,,#Osborne #Ikoyi #PatienceisKey,1218206000492220416,https://twitter.com/followlastma/status/1218206000492220416,"[5:15PM] A broken down LT Bus on Osborne INW Simpson, with the backlog of traffic as far back as Alfred Rewane and Obalende respectively. Effort is on to get it off the road."
2020-01-17 09:40:41,followlastma,,0,0,1,,,#PatienceisKey #ThankULagos,1218105854999846912,https://twitter.com/followlastma/status/1218105854999846912,We implore all motorists plying that axis to adhere to traffic instructions from our officers to allow for a smooth journey thru.
2020-01-17 09:40:40,followlastma,,2,7,10,,@followlastma,#ImpendigDanger #RoadHazard,1218105851354984449,https://twitter.com/followlastma/status/1218105851354984449,"[10:05AM] A container laden truck having spring problem at Oloosha inward Oshodi causing some traffic ATM, on ground to manage traffic situation even as effort is on to fix it."
2020-01-17 09:35:45,followlastma,,0,0,1,,,#ThankULagos,1218104612512763910,https://twitter.com/followlastma/status/1218104612512763910,We implore motorists coming from Obanikoro going thru Fadeyi to Ojuelegba or Jibowu to resist the temptation of stopping to look or take pictures to avoid causing another slow movement.
2020-01-17 09:33:02,followlastma,,1,1,1,,,#PatienceisKey,1218103930384719875,https://twitter.com/followlastma/status/1218103930384719875,... Effort is on to recover the content and truck.
2020-01-17 09:33:00,followlastma,,3,6,7,,@Fadeyi @Stadium,#Accident #IkoroduRd #Fadeyi,1218103920234565633,https://twitter.com/followlastma/status/1218103920234565633,". In a lone Accident, a wheat Laden Truck spilled its content on the road INW Onipan. Traffic backlog now and spilling. Alternative Route: Service Lane from Ojuelegba, Or, Yaba-Moroco Rd-Onipan."
2020-01-16 12:22:14,followlastma,,0,3,10,,@TrafficChiefNG @Gidi_Trafficpic,,1217784121419804672,https://twitter.com/followlastma/status/1217784121419804672,A broken down loaded Sewage Tanker on Falomo Bridge inward Akin Adeshola with mechanical fault backlog has extended to the stretch of Alfred Rewane
2020-01-15 17:25:46,followlastma,,0,1,1,,@TrafficChiefNG @Gidi_Traffic @trafficbutter @lagostraffic961 @lagostelevision,,1217498119073685504,https://twitter.com/followlastma/status/1217498119073685504,"RJ from Ilubirin, Dolphin inw Osborne is good but slight delay approaching Osborne intersection due to alternation. Falomo r/a inw AwolowoRd is busy due to commercial activities around the corridor."
2020-01-15 17:25:45,followlastma,,1,1,2,,@TrafficChiefNG @Gidi_Traffic @trafficbutter @lagostraffic961 @lagostelevision,#Ikoyi #Obalende,1217498117018390534,https://twitter.com/followlastma/status/1217498117018390534,[6.16pm] Good movement from FalomoBridge connecting AlfredRewane but heavy from GoldenGate intersection to Osborne through to Ilubirin due to high traffic influx.
2020-01-15 17:21:17,followlastma,,0,0,0,,@TrafficChiefNG @Gidi_Traffic @trafficbutter @lagostraffic961 @lagostelevision,,1217496990919155713,https://twitter.com/followlastma/status/1217496990919155713,Moving to IyanaIsolo is gathering momentum. Proceeding to FiveStar is ok but approaching Toyota is gathering momentum. The rest of the journey to Gbagada is good.
2020-01-15 17:21:16,followlastma,,1,0,0,,@TrafficChiefNG @Gidi_Traffic @trafficbutter @lagostraffic961,,1217496988394098693,https://twitter.com/followlastma/status/1217496988394098693,"Proceeding to OshodiOke, Boladale, Charity, Toyota is good. Movement inw FiveStar, IyanaIsolo, Ilasa, Ballet is ok but approaching Cele is slightly busy. RJ Cele to Ballet, Ilasa is a slow moving traffic."
2020-01-15 17:21:15,followlastma,,1,1,1,,@TrafficChiefNG @Gidi_Traffic @trafficbutter @lagostraffic961 @lagostelevision,#OshodiApapaExp #PMTrafficUpdates,1217496984380235783,https://twitter.com/followlastma/status/1217496984380235783,"[5.54pm] Gbagada to FirstPedro is busy. Moving to 2ndPedro, WestEnd, AnthonyOke is ok. Descending towards Barracks and LASTMA Office is a slow moving traffic."
2020-01-15 17:01:00,followlastma,,0,0,0,,@TrafficChiefNG @Gidi_Traffic @trafficbutter @lagostraffic961 @lagostelevision,,1217491886174343170,https://twitter.com/followlastma/status/1217491886174343170,Acme inw Wemco is ok but busy on the RJ. Wemco inw Omole is good but busy on the RJ. Allen r/a inw Aromire is busy.
2020-01-15 17:00:59,followlastma,,1,0,0,,@TrafficChiefNG @Gidi_Traffic @trafficbutter @lagostraffic961 @lagostelevision,,1217491882978267136,https://twitter.com/followlastma/status/1217491882978267136,"Barracks inw Coca-Cola is busy. Coca-Cola inw Radio is busy in/Out. Coca-Cola inw Agidingbi, Mobil is good. Mobil inw Cadbury is busy. Cadbury inw Acme is Busy."
2020-01-15 17:00:58,followlastma,,1,4,0,,@TrafficChiefNG @Gidi_Traffic @trafficbutter @lagostraffic961 @lagostelevision,#Ikeja #PMTrafficUpdates,1217491880298131456,https://twitter.com/followlastma/status/1217491880298131456,"[5.40pm] Otedola UBridge inw NurudeenOlowopo, Barracks, Ministry of Environment is good. Alausa intersection inw MobolajiJohnson enroute Billingsway jxn, 7up is OK."
2020-01-15 16:54:27,followlastma,,0,0,0,,@TrafficChiefNG @Gidi_Traffic @trafficbutter @lagostraffic961 @lagostelevision,,1217490237687062528,https://twitter.com/followlastma/status/1217490237687062528,GeneralHospital UBridge inw LocalAirport is good but slow on the RJ. ObaAkinjobi in/out is good. Ikeja UBridge inw ObaAkran is a slow moving traffic. Ladipo inw PWD is good.
2020-01-15 16:54:26,followlastma,,1,1,2,,@TrafficChiefNG @Gidi_Traffic @trafficbutter @lagostraffic961 @lagostelevision,#Maryland #PMTrafficUpdates,1217490234809647104,https://twitter.com/followlastma/status/1217490234809647104,[5.35pm] Anthony inw Maryland is building up. Maryland inw GeneralHospital UBridge is a slow moving traffic on the RJ is good.
2020-01-15 16:45:05,followlastma,,0,0,0,,@TrafficChiefNG @Gidi_Traffic @trafficbutter @lagostraffic961 @lagostelevision,,1217487882937565185,https://twitter.com/followlastma/status/1217487882937565185,Ogolonto inw Agric to Aruna is good. Slow approaching Benson to Ikorodu r/a.
2020-01-15 16:45:04,followlastma,,1,0,0,,@TrafficChiefNG @Gidi_Traffic @trafficbutter @lagostraffic961 @lagostelevision,,1217487877438869504,https://twitter.com/followlastma/status/1217487877438869504,Movement inw OwodeOnirin is ok but slow approaching the b/stop. Movement inw Odogun down to Majidun is very good. Majidun to Ogolonto is slow due to traffic alternation.
2020-01-15 16:45:03,followlastma,,1,2,0,,@TrafficChiefNG @Gidi_Traffic @trafficbutter @lagostraffic961 @lagostelevision,,1217487872334475267,https://twitter.com/followlastma/status/1217487872334475267,"Interchange inw Tollgate is good. Interchange inw Tipper to Demurin is busy. Movement inw Kosofe to Mile12 is good. Steady approaching Adekunle, slow to OwodeElede."
2020-01-15 16:37:07,followlastma,sophistreetcate,0,0,2,,,,1217485874822291456,https://twitter.com/followlastma/status/1217485874822291456,
2020-01-15 16:29:01,followlastma,,1,1,0,,@TrafficChiefNG @Gidi_Traffic @trafficbutter @lagostraffic961 @lagostelevision,,1217483836931682304,https://twitter.com/followlastma/status/1217483836931682304,"A bit slow at Barracks, steady to Ojuelegba, good inw DormanLong to Fadeyi. Fadeyi inw Anthony to Channels intersection is very good. Very busy approaching Odoyalaro bridge to Ojota Interchange."
2020-01-15 16:29:00,followlastma,,1,0,0,,@TrafficChiefNG @Gidi_Traffic @trafficbutter @lagostraffic961 @lagostelevision,,1217483834213703682,https://twitter.com/followlastma/status/1217483834213703682,RJ from Masha through Shitta to Stadium UBridge is good but slow approaching the alternation point. Alaka inw StadiumBridge to Barracks is good.
2020-01-15 16:28:58,followlastma,,1,0,0,,@TrafficChiefNG @Gidi_Traffic @trafficbutter @lagostraffic961 @lagostelevision,,1217483827485999104,https://twitter.com/followlastma/status/1217483827485999104,"Movement on EkoBridge inw Alaka main carriageway is good. Alaka service lane inw Stadium UBridge is ok, though slow at the alternation point. Movement inw Shitta, Masha axus is ok."
2020-01-15 16:28:58,followlastma,,1,0,0,,@TrafficChiefNG @Gidi_Traffic @trafficbutter @lagostraffic961 @lagostelevision,,1217483824772341760,https://twitter.com/followlastma/status/1217483824772341760,Movement inw IjoraOlopa to EkoBridge is good. Descending to Costain r/a is slow due ti traffic alternation. Movement inw Iponri to Alaka service lane is good.
2020-01-15 16:28:57,followlastma,,1,0,0,,@TrafficChiefNG @Gidi_Traffic @trafficbutter @lagostraffic961 @lagostelevision,,1217483821924409345,https://twitter.com/followlastma/status/1217483821924409345,"Steady at the r/a, slow through Apongbon service lane to OfinCanal. Slow along BroadStr from Davies jxn to Apongbon service lane. Apongbon Bridge inw OfinCanal is busy."
2020-01-15 16:28:56,followlastma,,1,0,1,,@TrafficChiefNG @Gidi_Traffic @trafficbutter @lagostraffic961 @lagostelevision,#IkoroduRd #PMTrafficUpdates,1217483819386916864,https://twitter.com/followlastma/status/1217483819386916864,[5.24pm] Movement from InnerMarina through StateHouse to CMS is ok. CMS inw Apongbon Bridge is good. CMS inw UBA r/a is good.
2020-01-15 13:47:49,followlastma,,0,10,7,,@TrafficChiefNG @Gidi_Traffic @trafficbutter @lagostraffic961 @lagostelevisionpic,#Anthony #lastmareports,1217443269904302080,https://twitter.com/followlastma/status/1217443269904302080,[2.38pm] An accident involving a trailer laden with container at VIS ascending Anthony inw Oshodi. Effort being made for evacuation. Please drive carefully.
2020-01-15 11:57:10,followlastma,followlastma,0,0,0,,,,1217415423559438336,https://twitter.com/followlastma/status/1217415423559438336,Now off the road. 
2020-01-15 11:37:40,followlastma,,0,1,9,,@TrafficChiefNG @Gidi_Traffic @trafficbutter @lagostraffic961 @lagostelevisionpic,#Dopemu #lastmareports,1217410517301633027,https://twitter.com/followlastma/status/1217410517301633027,[12.27pm] A brokendown flat body trailer loaded with iron rods havng mechanical problem at Dopemu UBridge inw IyanaIpaja. Owners working on it. Traffic still ok inw IyanaIpaja.
2020-01-15 10:23:35,followlastma,,0,0,0,,@TrafficChiefNG @Gidi_Traffic @trafficbutter @lagostraffic961 @lagostelevision,,1217391874538864643,https://twitter.com/followlastma/status/1217391874538864643,Movement on the RJ is now very much better. Only slow approaching the scene of the incident due to onlookers. Please be patient.
2020-01-15 10:23:33,followlastma,,2,2,3,,@TrafficChiefNG @Gidi_Traffic @trafficbutter @lagostraffic961 @lagostelevision,,1217391866791985153,https://twitter.com/followlastma/status/1217391866791985153,Both vehicles involved in the accident on IkoroduRd have now been totally evacuated. The main carriageway is now open for movement inw Fadeyi. Backlog is still extended beyond the Interchange.
2020-01-15 09:42:37,followlastma,,1,1,4,,@TrafficChiefNG @Gidi_Traffic @trafficbutter @lagostraffic961 @lagostelevision,,1217381562481827840,https://twitter.com/followlastma/status/1217381562481827840,"Currently, traffic movement is still busy from the Interchange down to Anthony for now. Movement beyond the incident all the way down to the Island is very GTG. Please be patient."
2020-01-15 09:39:35,followlastma,,1,1,5,,@TrafficChiefNG @Gidi_Traffic @trafficbutter @lagostraffic961,,1217380799533715456,https://twitter.com/followlastma/status/1217380799533715456,"Both vehicles have been lifted on their tyres and should be evacuated totally very soon. The road is now open for those coming from Fadeyi. The backlog, now at StadiumBridge, should be moving better soon."
2020-01-15 08:14:11,followlastma,May0waBabatunde,1,0,0,,,,1217359310185017344,https://twitter.com/followlastma/status/1217359310185017344,
2020-01-15 08:05:22,followlastma,,2,10,8,,,,1217357090894815232,https://twitter.com/followlastma/status/1217357090894815232,"LAGOS TACKLES OKADA, TRICYCLE MENACE The Lagos State Government has embarked on massive advocacy and enlightenment campaign to tackle the okada and tricycle menace. Please share with friends and family. "
2020-01-15 07:51:22,followlastma,,1,1,3,,@TrafficChiefNG @Gidi_Traffic @trafficbutter @lagostraffic961,,1217353568862265344,https://twitter.com/followlastma/status/1217353568862265344,Backlog of traffic is now at Barracks inw Fadeyi to Obanikoro. Alternative movement: From Ojuelegba through Yaba towards HerbertMacaulayWay to link the 3MB and continue your journey inw IyanaOworo and Alapere.
2020-01-15 07:49:59,followlastma,May0waBabatunde,1,0,2,,,,1217353219015311360,https://twitter.com/followlastma/status/1217353219015311360,"The LRU truck tried to lift the containerized truck earlier using a cable but was unable to do that, though it has lifted it a bit so it is suspended until the bigger tow truck arrives. This is why the tow truck is still there and the road still cordoned off."
2020-01-15 07:16:26,followlastma,,3,3,5,,@TrafficChiefNG @Gidi_Traffic @trafficbutter @lagostraffic961 @lagostelevisionpic,,1217344775130689538,https://twitter.com/followlastma/status/1217344775130689538,This is the current situation at the scene of the accident. Recovery process is still on. Please be patient.
2020-01-15 07:10:50,followlastma,,0,0,0,,@TrafficChiefNG @Gidi_Traffic @trafficbutter @lagostraffic961 @lagostelevision,,1217343365173391365,https://twitter.com/followlastma/status/1217343365173391365,"Proceeding to Alagomeji is ok but approaching Sabo is a slow moving traffic. Movement inw StAgnes is ok. Moving to Yabatech, WAEC, Jibowu is ok."
2020-01-15 07:10:48,followlastma,,1,1,1,,@TrafficChiefNG @Gidi_Traffic @trafficbutter @lagostraffic961 @lagostelevision,,1217343358894596096,https://twitter.com/followlastma/status/1217343358894596096,RJ Iddo to Otto is ok but approaching Oyingbo market is gathering momentum. Proceeding to Adekunle jxn is ok. Movement inw Panti is a slow moving traffic.
2020-01-15 07:10:47,followlastma,,1,4,3,,@TrafficChiefNG @Gidi_Traffic @trafficbutter @lagostraffic961 @lagostelevision,#Shomolu #AMTrafficUpdates,1217343354435854336,https://twitter.com/followlastma/status/1217343354435854336,"[7.55am] Jibowu to Yaba is ok. Proceeding to Alagomeji, Adekunle, PostOffice is ok but approaching ApapaRd jxn and Oyingbo is slightly busy. Movement inw Otto, Iddo is ok."
2020-01-15 07:05:14,followlastma,,0,0,0,,@TrafficChiefNG @Gidi_Traffic @trafficbutter @lagostraffic961 @lagostelevision,,1217341957040721920,https://twitter.com/followlastma/status/1217341957040721920,"BroadStr inw Apongbon UBridge is good. Apongbon UBridge inw EkoBridge, Costain is ok."
2020-01-15 07:05:13,followlastma,,1,1,0,,@TrafficChiefNG @Gidi_Traffic @trafficbutter @lagostraffic961 @lagostelevision,#Apongbon #AMTrafficUpdates,1217341954746474496,https://twitter.com/followlastma/status/1217341954746474496,[7.44am] Costain inw EkoBridge is heavy. EkoBridge inw Ijora intersection is a slow moving traffic. Movement inw Apongbon to CMS is good.
2020-01-15 07:01:50,followlastma,,0,0,0,,@TrafficChiefNG @Gidi_Traffic @trafficbutter @lagostraffic961 @lagostelevision,,1217341102988107776,https://twitter.com/followlastma/status/1217341102988107776,ObaAkinjobi in/out is good. Ikeja UBridge inw ObaAkran is good. Ladipo inw PWD is OK. AdekunleFajuyi inw BankAnthonyWay is busy.
2020-01-15 07:01:49,followlastma,,1,3,2,,@TrafficChiefNG @Gidi_Traffic @trafficbutter @lagostraffic961,#Maryland #AMTrafficUpdates,1217341098860761088,https://twitter.com/followlastma/status/1217341098860761088,[7.39am] Anthony inw Maryland is ok. Maryland inw General hospital UBridge is good. Nitel inw Maryland is a slow moving traffic. GeneralHospital UBridge inw LocalAirport in/out is OK.
2020-01-15 06:56:19,followlastma,,0,1,0,,@TrafficChiefNG @Gidi_Traffic @trafficbutter @lagostraffic961 @lagostelevision,,1217339711708069888,https://twitter.com/followlastma/status/1217339711708069888,"From there to JakandeGate is a moving traffic. Proceeding to OkeAfa, Pako is ok."
2020-01-15 06:56:18,followlastma,,1,1,0,,@TrafficChiefNG @Gidi_Traffic @trafficbutter @lagostraffic961 @lagostelevision,,1217339708008812545,https://twitter.com/followlastma/status/1217339708008812545,"Proceeding to Hostel, IleEpo is ok but approaching IyanaEjigbo is slightly busy. Proceeding to NEPA is ok but approaching NNPC is slightly busy. Movement inw Fatgbems is ok."
2020-01-15 06:56:17,followlastma,,1,2,0,,@TrafficChiefNG @Gidi_Traffic @trafficbutter @lagostraffic961 @lagostelevision,#Ikotun #Egbe #AMTrafficUpdates,1217339703709634560,https://twitter.com/followlastma/status/1217339703709634560,[7.35am] OldGarage to Ikotun r/a is slightly busy. Movement inw Ojuodo is busy. Moving to Synagogue is ok but approaching IleIwe is slightly busy.
2020-01-15 06:50:20,followlastma,,0,0,0,,@TrafficChiefNG @Gidi_Traffic @trafficbutter @lagostraffic961 @lagostelevision,,1217338208591192064,https://twitter.com/followlastma/status/1217338208591192064,"Pelewura inw PolicePost is good in/out. Oyebanji inw Idumagbo, Tom Jones is good."
2020-01-15 06:50:19,followlastma,,1,0,2,,@TrafficChiefNG @Gidi_Traffic @trafficbutter @lagostraffic961 @lagostelevision,,1217338205026111489,https://twitter.com/followlastma/status/1217338205026111489,Eyineyo inw Idumota enroute CarterBridge is good. TomJones inw Idumagbo Avenue is good. TomJones inw Oyebanji is good. Oyebanji inw Pelewura is a steady moving traffic.
2020-01-15 06:50:18,followlastma,,2,1,2,,@TrafficChiefNG @Gidi_Traffic @trafficbutter @lagostraffic961 @lagostelevision,#Idumota #AMTrafficUpdates,1217338200869494791,https://twitter.com/followlastma/status/1217338200869494791,[7.28am] CarterBridge inw Idumota is good. Idumota inw Eyineyo is a steady moving traffic. Martins inw BroadStr is a slow moving traffic.
2020-01-15 06:45:07,followlastma,unlimitedLG,0,0,1,,,,1217336893140094976,https://twitter.com/followlastma/status/1217336893140094976,
2020-01-15 06:43:35,followlastma,,1,1,1,,@TrafficChiefNG @Gidi_Traffic @trafficbutter @lagostraffic961 @lagostelevision,,1217336511030611968,https://twitter.com/followlastma/status/1217336511030611968,"For those icoming from Ojota, the backlog is at the Interchange already merging with the heavy traffic from Mile12 axis. Traffic is also diverted into the service lane at Anthony."
2020-01-15 06:43:35,followlastma,,1,0,0,,@TrafficChiefNG @Gidi_Traffic @trafficbutter @lagostraffic961 @lagostelevision,,1217336509159870466,https://twitter.com/followlastma/status/1217336509159870466,"For those coming from Fadeyi, traffic is busy from Igbobi to Obanikoro where traffic is diverted into the service lane."
2020-01-15 06:43:35,followlastma,,1,0,0,,@TrafficChiefNG @Gidi_Traffic @trafficbutter @lagostraffic961 @lagostelevision,,1217336507289296896,https://twitter.com/followlastma/status/1217336507289296896,The main carriageway has been cordoned off both in and out IkoroduRd at the point of the incident to allow for evacuation. All traffic diverted to the service lane both ways.
2020-01-15 06:43:34,followlastma,,1,2,5,,@lasemasocial @rrslagos767 @lnsalagos @LAG_FireService,#IkoroduRd #lastmareports,1217336505175289857,https://twitter.com/followlastma/status/1217336505175289857,[7.40am] Overnight accident between a trailer loaded with container and another truck just before Obanikoro inw Fadeyi. and other emergency agencies are on ground.
2020-01-15 06:15:13,followlastma,LagosDriver,0,0,1,,,,1217329369401696257,https://twitter.com/followlastma/status/1217329369401696257,Thank you for the notification. We'll confirm.
2020-01-15 06:13:44,followlastma,,0,0,0,,@TrafficChiefNG @Gidi_Traffic @trafficbutter @lagostraffic961 @lagostelevision,,1217328996427468801,https://twitter.com/followlastma/status/1217328996427468801,"Oando inw CathedralChurch is a slow moving traffic due to traffic alternation. CMS Bookshop inw TinubuSquare, MartinsStr is ok."
2020-01-15 06:13:43,followlastma,,1,2,2,,@TrafficChiefNG @Gidi_Traffic @trafficbutter @lagostraffic961 @lagostelevision,#Marina #AMTrafficUpdates,1217328993583738881,https://twitter.com/followlastma/status/1217328993583738881,"[7.07am] Onikan r/a inw TBS, GeneralHospital, CityHall is good. Nitel inw CMS bridge, UBA is good. UBA r/a inw Oando filling station is good."
2020-01-15 05:52:33,followlastma,,0,0,0,,@TrafficChiefNG @Gidi_Traffic @trafficbutter @lagostraffic961 @lagostelevision,,1217323667002216448,https://twitter.com/followlastma/status/1217323667002216448,FruitMkt is busy due to high traffic influx and pedestrians crossing. FruitMkt inw Tollgate and the Interchange is good.
2020-01-15 05:52:33,followlastma,,1,1,0,,@TrafficChiefNG @Gidi_Traffic @trafficbutter,,1217323665051787264,https://twitter.com/followlastma/status/1217323665051787264,Connecting Mile12 UBridge is slow Movement inw Ajelogo through Alapere axis to link the expressway is very good Ascending Mile12 Bridge inw Kosofe to IkosiRd jxn and FruitMkt is busy due to high traffic influx and pedestrians crossing.
2020-01-15 05:52:32,followlastma,,1,1,0,,@TrafficChiefNG @Gidi_Traffic @trafficbutter @lagostraffic961 @lagostelevision,,1217323663269208065,https://twitter.com/followlastma/status/1217323663269208065,"Agric inw Ogolonto down to Odogun is very GTG. Odogun to Ajegunle is good. Steady to Thomas, slow to Irawo due to b/stop activities. Irawo to Mile12 is good (only slow at Adekunle speed bump)."
2020-01-15 05:52:32,followlastma,,1,2,1,,@TrafficChiefNG @Gidi_Traffic @trafficbutter @lagostraffic961 @lagostelevision,#IkoroduRd #AMTrafficUpdates,1217323661067202560,https://twitter.com/followlastma/status/1217323661067202560,"[6.46am] Sabo r/a inw MuniratAleje jxn to Ikorodu r/a is ok. Slow between Ikorodu r/a and the BRT Terminal, steady to Benson. Movement to Jumofak is good, slow to Agric."
2020-01-14 15:57:01,followlastma,,0,1,0,,@trafficbutter,,1217113398531457026,https://twitter.com/followlastma/status/1217113398531457026,Salolo inw adura and casso is gd Busy approachn kola inw moshalashi It’s gd inw alakuko-amje and ajegunle It’s busy approachn tollgate
2020-01-14 15:57:01,followlastma,,1,2,1,,@trafficbutter,,1217113396123967489,https://twitter.com/followlastma/status/1217113396123967489,"*abule egba inw pencinema is gd bt it’s busy from orile inw pencinema, RJ is gd bt gets busy from abattoir inw charity jnctn . Abule egba inw awori and uturn is gd Slw inw abule taylor bt gd inw General/ahmadiyya/obadeyi/ijaiye/meiran dwn to salolo is all gd"
2020-01-14 15:57:00,followlastma,,1,1,1,,@trafficbutter,,1217113394001653761,https://twitter.com/followlastma/status/1217113394001653761,"Gd inw iyana dopemu, slw at pako bstop Gd inw adealu-araromi It’s busy from GIG motors inw Iyana-Ipaja ubridge(bstop activities/pedestrian crossing at iyana ipaja ubridge) Iyana ipaja inw pleasure-ileepo-super-abule egba is gd"
2020-01-14 15:57:00,followlastma,,1,2,2,,@trafficbutter,#LASTMAREPORTS #,1217113391849967616,https://twitter.com/followlastma/status/1217113391849967616,04:56PM. #*LAGOS ABEOKUTA EXPRESSWAY * Ilezik inw sule jnctn is busy Connecting mongoro inw onilekere and cement is gd(narrow rds at cement slws mvmnt) Smooth inw dopemu ubridge (bstop activities ubridge)
2020-01-14 15:41:00,followlastma,,0,2,1,,@trafficbutter,,1217109367310503936,https://twitter.com/followlastma/status/1217109367310503936,Connecting ladipo-shogunle-PWD-airport bstop and airport ubridge is gd It gets busy inw National and ikj along It’s gd inw ajayi farm and ilezik RJ back to oshodi ubridge is smooth Oshodi back to empire is also gd aside various bstop activities
2020-01-14 15:40:53,followlastma,,1,1,0,,@trafficbutter,,1217109336012529665,https://twitter.com/followlastma/status/1217109336012529665,Gd inw challenge and busy approachn vono intsctn Onw Mvmnt to ilupeju is gd(alt delays at ilupeju intsctn) Ilupeju bypass is busy Gd inw cappa and busy inw oshodi ubridge(bstop activities) Gd inw bolade(bstop delays at bolade)
2020-01-14 15:40:44,followlastma,,1,4,3,,@trafficbutter,#LASTMAREPORTS #,1217109300256169984,https://twitter.com/followlastma/status/1217109300256169984,"04:40PM. #*AGEGE MOTOR ROAD* Mvmnt from empire inw moshalashi is slw bt it’s gd inw idioro It’s busy inw olosha, slw inw regina mundi and busy inw ojuwoye Onw Mvmnt to AP dwn to Olorunsogo is gd It’s busy approachn palm ave jnctn"
