2019-12-04 06:59:16,followlastma,,0,0,1,,@TrafficChiefNG @Gidi_Traffic @trafficbutter @lagostelevision @lagostraffic961,,1202120165883817984,https://twitter.com/followlastma/status/1202120165883817984,No backlog for now. Effort been made to fix the problem and officers are on ground controlling traffic.
2019-12-04 06:59:15,followlastma,,1,2,4,,@TrafficChiefNG @Gidi_Traffic @trafficbutter @lagostelevision @lagostraffic961,#AgegeMotorRd #lastmareports,1202120163648258048,https://twitter.com/followlastma/status/1202120163648258048,[7.30am] There is a brokendown flat body trailer laden with covered goods having mechanical problem in the middle of the road shortly before Cement inw IyanaDopemu.
2019-12-04 06:49:58,followlastma,,0,1,1,,@TrafficChiefNG @Gidi_Traffic @trafficbutter @lagostelevision @lagostraffic961,,1202117826313621506,https://twitter.com/followlastma/status/1202117826313621506,Movement is now allowed through the main carriageway towards IkejaAlong and Airport U-Turn has commenced.
2019-12-04 06:49:57,followlastma,,1,3,4,,@TrafficChiefNG @Gidi_Traffic @trafficbutter @lagostraffic961pic,#AgegeMotorRd #lastmareports,1202117821305675776,https://twitter.com/followlastma/status/1202117821305675776,[7.25am] The main carriageway at Ile-Zik previously closed to traffic overnight is now open. Vehicular movement previously diverted into the BRT corridor at Ile-Zik has also been reversed.
2019-12-04 06:44:50,followlastma,,0,1,0,,@TrafficChiefNG @Gidi_Traffic @trafficbutter @lagostelevision @lagostraffic961,,1202116531976577024,https://twitter.com/followlastma/status/1202116531976577024,Better movement after CMS but slow approaching StateHouse intersection to McWen.
2019-12-04 06:44:49,followlastma,,1,1,0,,@TrafficChiefNG @Gidi_Traffic @trafficbutter @lagostelevision @lagostraffic961,,1202116529388752896,https://twitter.com/followlastma/status/1202116529388752896,Elegbata inw Leventis is ok. Leventis inw UBA r/a to InnerMarina is very good. Movement on Apongbon bridge inw CMS is very good. Slow approaching CMS.
2019-12-04 06:44:48,followlastma,,1,0,0,,@TrafficChiefNG @Gidi_Traffic @trafficbutter @lagostelevision @lagostraffic961,,1202116526951796738,https://twitter.com/followlastma/status/1202116526951796738,"Alaka ascending the bridge is busy. Better movement inw EkoBridge but very on the bridge around Costain down to Apongbon connecting Elegbata. Busy at Elegbata, steady inw EbuteEro."
2019-12-04 06:44:47,followlastma,,1,0,0,,@TrafficChiefNG @Gidi_Traffic @trafficbutter @lagostelevision @lagostraffic961,,1202116522560442368,https://twitter.com/followlastma/status/1202116522560442368,"Fadeyi inw DormanLong to StadiumBridge is very good. Descending StadiumBridge to Alaka is busy. Alaka service lane inw Iponri to Costain is ok. Slow at Costain r/a, busy connecting EkoBridge."
2019-12-04 06:44:46,followlastma,,1,0,0,,@TrafficChiefNG @Gidi_Traffic @trafficbutter @lagostelevision @lagostraffic961,,1202116517061627904,https://twitter.com/followlastma/status/1202116517061627904,"Slow from the intersection to IndependenceTunnel due to failed portion of road. Better movement exiting the Tunnel down to Fadeyi, though slow at Fadeyi. Fadeyi inw Jibowu is slightly busy."
2019-12-04 06:44:45,followlastma,,1,0,0,,@TrafficChiefNG @Gidi_Traffic @trafficbutter @lagostelevision @lagostraffic961,,1202116514440187907,https://twitter.com/followlastma/status/1202116514440187907,The Interchange inw Ojota is ok. Motorways descending inw Ojota service lane is busy. Ojota inw Odoyalaro to JesuOyingbo intersection is good.
2019-12-04 06:28:11,followlastma,followlastma,0,1,0,,,,1202112341489401856,https://twitter.com/followlastma/status/1202112341489401856,Now off the road. 
2019-12-04 06:27:13,followlastma,,1,0,0,,@TrafficChiefNG @Gidi_Traffic @trafficbutter @lagostelevision @lagostraffic961,,1202112098760843264,https://twitter.com/followlastma/status/1202112098760843264,"Movement on Mile12 bridge inw Kosofe to IyanaSchool. Movement to IleIle is ok, then slow to IkosiRd jxn. Movement inw FruitMkt connecting both Tollgate and the Interchange is good."
2019-12-04 06:27:12,followlastma,,1,0,0,,@TrafficChiefNG @Gidi_Traffic @trafficbutter @lagostelevision @lagostraffic961,,1202112096919535616,https://twitter.com/followlastma/status/1202112096919535616,Steady movement to OwodeOnirin. Good movement inw OwodeElede to Mile12. Movement connecting Mile12 UBridge is slow. Mile12 UBridge inw Ajelogo through Alapere axis to connect the expressway is GTG.
2019-12-04 06:27:12,followlastma,,1,0,0,,@TrafficChiefNG @Gidi_Traffic @trafficbutter @lagostelevision @lagostraffic961,,1202112095053107200,https://twitter.com/followlastma/status/1202112095053107200,Busy movement to Odogun due to a reported brokendown car at Odogun. Good movement to Ajegunle but busy to Irawo due to onlookers at the accident that happened in the BRT corridor.
2019-12-04 06:27:11,followlastma,,1,0,1,,@TrafficChiefNG @Gidi_Traffic @trafficbutter @lagostelevision @lagostraffic961,,1202112092997853185,https://twitter.com/followlastma/status/1202112092997853185,"There is a brokendown high capacity bus at Benson impeding traffic movement. Movement inw Agric, Ogolonto to Asolo is very GTG. Road rehabilitation ongoing at Asolo."
2019-12-04 06:27:11,followlastma,,1,1,1,,@TrafficChiefNG @Gidi_Traffic @trafficbutter @lagostelevision @lagostraffic961,#IkoroduRd #AMTrafficUpdate,1202112091135590405,https://twitter.com/followlastma/status/1202112091135590405,[7.22am] Ojubode inw Ikorodu r/a is busy. Sabo r/a inw MuniratAleje jxn to Total is good. Total inw Ikorodu r/a to Benson is busy.
2019-12-04 06:06:05,followlastma,,0,2,3,,@TrafficChiefNG @Gidi_Traffic @trafficbutter @lagostelevision @lagostraffic961pic,#Ikorodu #lastmareports,1202106781750702080,https://twitter.com/followlastma/status/1202106781750702080,[6.59am] Broken down HCB at Benson inward Haruna causing slow traffic movement back to Ikorodu garage. Effort is on for its removal.
2019-12-04 06:02:18,followlastma,,1,2,8,,@TrafficChiefNG @Gidi_Traffic @trafficbutter @lagostelevision @lagostraffic961pic,#Ikorodu #lastmareports,1202105830860034049,https://twitter.com/followlastma/status/1202105830860034049,[6.45am] A brokendown tipper at the exit of IsawoRd into Agric. Effort is been made to remove it. Officers on ground managing traffic movement.
2019-12-04 05:59:03,followlastma,,0,1,2,,@TrafficChiefNG @Gidi_Traffic @trafficbutter @lagostelevision @lagostraffic961,,1202105013365039104,https://twitter.com/followlastma/status/1202105013365039104,Adeniji inw Ilubirin is steady. The RJ is entirely GTG from Ilubirin down to Berger and Kara.
2019-12-04 05:59:03,followlastma,,1,1,3,,@TrafficChiefNG @Gidi_Traffic @trafficbutter @lagostelevision @lagostraffic961,#LagosIbadanExp #3MB #AMTrafficUpdate,1202105011616006145,https://twitter.com/followlastma/status/1202105011616006145,"[6.56am] Kara, Berger down to Carwash, IyanaOworo is very GTG. IyanaOworo inw Unilag Waterfront is good. Busy movement from Waterfront inw Adekunle to Adeniji."
2019-12-04 05:51:47,followlastma,,0,0,1,,@TrafficChiefNG @Gidi_Traffic @trafficbutter @lagostelevision @lagostraffic961,,1202103181792202752,https://twitter.com/followlastma/status/1202103181792202752,Movement around Alaba International is still ok. IyanaIba UTurn inw IyanaSchool is ok. RJ back to IyanaIba is gathering momentum.
2019-12-04 05:51:46,followlastma,,1,0,0,,@TrafficChiefNG @Gidi_Traffic @trafficbutter @lagostraffic961,,1202103178948464640,https://twitter.com/followlastma/status/1202103178948464640,"RJ from Customs down to Okoko is ok. Slow approaching IyanaIba due to b/stop activities. Movement to Pako is slow but steady to Volks. Good to Ilaje, slow inw Agris to Barracks. Steady inw Tradefair to AbuleAdo UTurn."
2019-12-04 05:51:46,followlastma,,1,0,0,,@TrafficChiefNG @Gidi_Traffic @trafficbutter @lagostelevision @lagostraffic961,,1202103177178501120,https://twitter.com/followlastma/status/1202103177178501120,Good movement inw AfolabiEge to IyanaIba. IyanaIba inw Okoko to IyanaIsashi is good. Slow approaching IyanaEra due to ongoing road rehabilitation. Better movement inw Customs Checkpoint.
2019-12-04 05:51:45,followlastma,,1,2,2,,@TrafficChiefNG @Gidi_Traffic @trafficbutter @lagostelevision @lagostraffic961,#LagosBadagryExp #AMTrafficUpdate,1202103175244918784,https://twitter.com/followlastma/status/1202103175244918784,[6.48am] AbuleAdo UTurn inw Tradefair UBridge is good. Movement from Tradefair inw Barracks is busy. Very slow at Barracks. Barracks inw Volks is ok.
2019-12-01 05:53:58,followlastma,,1,8,4,,@TrafficChiefNG @Gidi_Traffic @trafficbutter @lagostraffic961,#LagosIbadanExp #3MB #Ikoyi,1201016568936747008,https://twitter.com/followlastma/status/1201016568936747008,"[6.50am] Movement from Kara, Berger through 3MB to Ilubirin is very GTG in/out. Ilubirin inw Obalende and OsborneRd, as well as movement in other areas within Ikoyi, is entirely very GTG."
2019-11-30 08:27:12,followlastma,,5,9,10,,,,1200692743271526400,https://twitter.com/followlastma/status/1200692743271526400,"LASTMA GENERAL MANAGER CONDEMN ATTACK ON ITS OFFICIALS The General Manager of LASTMA, Olajide Oduyoye has condemned in its entirety the continued attack on the officers of the agency in the course of carrying out ?igshid=8laav9z2hcx8 "
2019-11-29 16:55:58,followlastma,,0,0,1,,@trafficbutter,,1200458392667611137,https://twitter.com/followlastma/status/1200458392667611137,"Lasu inw firstgate is ok,busy at igboElerin First gate inw iyanaschool is slow RJ from iyanaschool inw lasugate is gtg,towards iyanaiba is a steady movemt"
2019-11-29 16:55:58,followlastma,,1,1,3,,@trafficbutter,#Ojo,1200458389903556616,https://twitter.com/followlastma/status/1200458389903556616,"05:55PM. LASTMAREPORTS /iyanaiba Good movtmt from tradefairU/B all tru to AfolabiEge,towards iyanaiba is steady Alabarago inw okoko is OK,towards iyanaisashi to iyanaira is busy,enroute checkpoint is gtg"
2019-11-29 16:53:29,followlastma,,0,0,1,,@trafficbutter,,1200457767217176577,https://twitter.com/followlastma/status/1200457767217176577,Onw Mvmnt to hotel/lanre/oko filling/general/alhaji ede/college is all gd It’s slw approachn igando bstop (bstop/commercial activities) RJ back to isheri is gd aside various bstop activities
2019-11-29 16:53:29,followlastma,,1,1,2,,@trafficbutter,#LASTMAREPORTS #ISHERI,1200457764809707521,https://twitter.com/followlastma/status/1200457764809707521,05:52PM. /IGANDO Mvmnt from isheri r’abt inw diamond estate/Idowu egba is all gd Very slw approachn odo(bstop activities/pedestrian crossing)
2019-11-29 16:35:10,followlastma,,0,0,2,,@trafficbutter,,1200453154397179904,https://twitter.com/followlastma/status/1200453154397179904,"The entire stretch of GRA,gen.ogunaike is gtg,towards isaacjohn is a moving traffic while part of AdekunleFajuyi connectg mobalajibank Anthony to Maryland is slow due to high influx LadipoBateye inw pwd to link Agege motor road is a moving traffic"
2019-11-29 16:35:09,followlastma,,2,0,2,,@trafficbutter,,1200453152140615680,https://twitter.com/followlastma/status/1200453152140615680,RJ from local airport inw
2019-11-29 16:35:08,followlastma,,1,0,2,,@trafficbutter,#LASTMAREPORTS #Maryland,1200453149267550208,https://twitter.com/followlastma/status/1200453149267550208,"06:34PM. Anthony inw Maryland to odoiyalaro is slow RJ from odoiyalaro to Maryland is gtg,towards Anthony is slow Maryland inw leventis to to Nigel is gtg,towards custom is slow Genhosp inw local airport is busy"
2019-11-29 16:33:23,followlastma,,0,0,0,,@trafficbutter,,1200452709465444353,https://twitter.com/followlastma/status/1200452709465444353,Anthony Oke inw BERTOLA connecting Ikorodu road is gud. Anthony Oke back to Gbagada is gud. Total inw Oshodi by Heritage garden is slow on the service lane.The Main carriage way is cordoned off. Heritage garden inw Oshodi Oke is ok
2019-11-29 16:33:23,followlastma,,1,1,4,,@trafficbutter,#LASTMAREPORTS #Gbagada,1200452707112357888,https://twitter.com/followlastma/status/1200452707112357888,05:32PM. /APAPA OSHODI EXPRESSWAY: Carwash/Y junction inw Gbagada is gud all the way to Anthony Oke where it is steady. Hotel New Castle inw Anthony Village is steady. Anthony Oke inw LASAMBUS Point/Total is slow.
2019-11-29 16:31:32,followlastma,,0,0,1,,@trafficbutter,,1200452241016197121,https://twitter.com/followlastma/status/1200452241016197121,Park n Ride inw CMD IS GUD. CMD inw Berger/New Garage is busy. New Garage inw Kara is slow. Kara inw New Garage is steady on the return journey. 7up inw Motorways is slow. Other locations are gud on the return journey.
2019-11-29 16:31:31,followlastma,,1,0,1,,@trafficbutter,#LASTMAREPORTS #TMB,1200452238709276672,https://twitter.com/followlastma/status/1200452238709276672,05: . /LAGOS IBADAN EXPRESSWAY: Obalende inw Ilubirin is busy. Ilubirin inw Iyana Oworo is gud all the way Ojota Interchange at this time. Ojota Interchange inw Ikosi junction/Park n Ride is slow.
2019-11-29 16:30:19,followlastma,,0,0,1,,@trafficbutter,,1200451936358674432,https://twitter.com/followlastma/status/1200451936358674432,"Inner part of ireAkari to isolo is OK Chemist inw pako is a moving traffic OkeAfa inw pako,college, Aye,limca to laspotech is a moving traffic in & out 5star inw ballet is a moving traffic Cele inw ijesha is OK both on servicelane and maincarriage way"
2019-11-29 16:30:19,followlastma,,1,0,1,,@trafficbutter,#LASTMAREPORTS #Okota,1200451933988892674,https://twitter.com/followlastma/status/1200451933988892674,05:30PM. /isolo Celexpress inw Okota to AgoR/A is OK in&out Cele link bridge inw iyanaitire is OK in&out Agopalace way inw AppleJunctn is gd in&out Apata inw transformer to ilasa is a moving traffic in&out
2019-11-29 16:29:24,followlastma,,0,0,0,,@trafficbutter,,1200451706867404801,https://twitter.com/followlastma/status/1200451706867404801,"Cele inw Pleasure/Fan Milk is ok,bt busy shortly after inw Iyana Ipaja under bridge. Iyana Ipaja inw Dopemu under bridge is steady under the bridge due to b/stp activities and also slow around Idi-Mangoro. Idi-Mangoro inw Ile Zik is gud"
2019-11-29 16:29:24,followlastma,,1,1,1,,@trafficbutter,,1200451704828891136,https://twitter.com/followlastma/status/1200451704828891136,"It is steady leaving Amje bt slow shortly after inw Alakuko. Alakuko inw Master Energy is gud. Master Energy inw Kola is slow. Kola inw Abule Egba is ok,bt slow at Super inw Cele."
2019-11-29 16:29:23,followlastma,,1,0,1,,@trafficbutter,,1200451702719229953,https://twitter.com/followlastma/status/1200451702719229953,Kola inw Mashalashi is steady. Mashalashi inw Alakuko is ok. Alakuko inw Ajegunle is busy. Ajegunle inw Tollgate is slow. Return journey is steady leaving Tollgate inw Ajegunle. Ajegunle uinw Amje is slow.
2019-11-29 16:29:23,followlastma,,1,0,0,,@trafficbutter,,1200451700471021568,https://twitter.com/followlastma/status/1200451700471021568,"Iyana Ipaja under bridge inw Ile Epo is ok,bt steady at Ile Epo. Ile Epo inw Salolo is gud. Salolo inw Adura is steady. Adura inw Casso is ok. Casso inw Kola is slow. It is steady leaving Casso,bt slow approaching Kola."
2019-11-29 16:29:22,followlastma,,1,0,2,,@trafficbutter,#LASTMAREPORTS #LAGOS,1200451697430220800,https://twitter.com/followlastma/status/1200451697430220800,05:27PM. ABEOKUTA EXPRESSWAY: Ile Zik inw Mangoro/Cement/United Biscuit is gud. United Biscuit inw Dopemu under bridge is busy. Dopemu under bridge ine Iyana Ipaja b/stp is ok. Iyana Ipaja b/stp inw Iyana Ipaja under bridge is slow.
2019-11-29 16:27:02,followlastma,,0,0,0,,@trafficbutter,,1200451111217516545,https://twitter.com/followlastma/status/1200451111217516545,"RJ from ojota inw olusosun is a moving traffic, towards welfare,ikosi,AlausaB/S is gtg Alausa inw Radio is slow In&out of opebi link bridge is a moving traffic"
2019-11-29 16:27:02,followlastma,,1,1,0,,@trafficbutter,,1200451107861991426,https://twitter.com/followlastma/status/1200451107861991426,"RJ from Sheraton inw salvation to AdebolaHouse is a moving, towards toyin to firstbank is OK RJ from first bank to AllenR/A is slow Radio inw clay is gd,towards ikosi junction to welfare is a moving traffic Olusosun to ojota is a moving traffic"
2019-11-29 16:27:01,followlastma,,1,1,2,,@trafficbutter,#LASTMAREPORTS #Opebi,1200451105630629888,https://twitter.com/followlastma/status/1200451105630629888,"05:26 PM. Axis AllenR/A inw toyin is gtg,towards custom is a moving traffic RJ from custom inw toyin is gtg,towards AdebolaHouse is a moving traffic Salvation inw Sheraton link bridge is gtg"
2019-11-29 16:25:52,followlastma,,0,0,0,,@trafficbutter,,1200450816995446784,https://twitter.com/followlastma/status/1200450816995446784,"Oloosa inw AP is steady. AP inw Ile Zik is ok,aside frm alternation points nd b/stp activities wch are nothing to worry about."
2019-11-29 16:25:52,followlastma,,3,1,1,,@trafficbutter,#LASTMAREPORTS #AGEGE,1200450815074418688,https://twitter.com/followlastma/status/1200450815074418688,05:25PM. MOTOR ROAD: Empire inw Mashalshi is steady. Mashalashi inw Alakara Police Station is ok. Alakara inw Idi-Oro is steady. Idi-Oro inw Oloosa is gud.
2019-11-28 17:06:55,followlastma,,0,0,0,,@TrafficChiefNG @Gidi_Traffic @trafficbutter @lagostelevision @lagostraffic961,,1200098758937268225,https://twitter.com/followlastma/status/1200098758937268225,Barracks inw Ojuelegba to DormanLong is busy. Better movement on DormanLong bridge inw Fadeyi to NewGarage is very good. Busy from NewGarage inw Ojota to the Interchange.
2019-11-28 17:06:51,followlastma,,1,0,0,,@TrafficChiefNG @Gidi_Traffic @trafficbutter @lagostelevision @lagostraffic961,,1200098742613037068,https://twitter.com/followlastma/status/1200098742613037068,EkoBridge inw Alaka main carriageway is good. Alaka service lane inw Stadium UBridge is slow. Stadium UBridge inw Shitta is steady. Alaka inw Stadium to Barracks is GTG.
2019-11-28 17:06:50,followlastma,,1,0,0,,@TrafficChiefNG @Gidi_Traffic @trafficbutter @lagostelevision @lagostraffic961,,1200098739714772992,https://twitter.com/followlastma/status/1200098739714772992,"Movement inw IjoraOlopa intersection to EkoBridge is very good. EkoBridge inw Costain r/a is good, though a bit slow at the r/a. Costain inw Iponri to Alaka service lane is GTG."
2019-11-28 17:06:50,followlastma,,1,1,2,,@TrafficChiefNG @Gidi_Traffic @trafficbutter @lagostelevision,#IkoroduRd #PMTrafficUpdate,1200098737080688641,https://twitter.com/followlastma/status/1200098737080688641,[6.05pm] McWen inw CMS is good. Busy from CMS inw Apongbon to OfinCanal. CMS inw UBA r/a is steady. Slow inw Apongbon service lane. BroadStr inw Apongbon service lane is also slow.
2019-11-28 16:44:19,followlastma,,0,1,0,,@TrafficChiefNG @Gidi_Traffic @trafficbutter @lagostelevision @lagostraffic961,,1200093069200252930,https://twitter.com/followlastma/status/1200093069200252930,Alexander r/a via Lekki-Ikoyi LinkBridge to AdmiraltyWay is very busy. Also busy on the RJ to the Tollplaza but better after the Tollplaza to Alexander r/a.
2019-11-28 16:44:18,followlastma,,1,1,0,,@TrafficChiefNG @Gidi_Traffic @trafficbutter @lagostelevision @lagostraffic961,,1200093066733989888,https://twitter.com/followlastma/status/1200093066733989888,"Better movement down to Falomo r/a. Falomo r/a inw Bourdillon, Alexander and Gerrard is good but slow approaching Osborne. RJ back to Falomo r/a is GTG."
2019-11-28 16:44:17,followlastma,,1,0,0,,@TrafficChiefNG @Gidi_Traffic @trafficbutter @lagostelevision @lagostraffic961,,1200093062862659586,https://twitter.com/followlastma/status/1200093062862659586,"Better movement after the jxn but slow approaching Mobil towards Obalende bridge. Better approaching Onikan r/a. RJ from Onikan is ok but slow to DHL. Steady to Keffi, slow to Ribadu."
2019-11-28 16:44:16,followlastma,,1,0,0,,@TrafficChiefNG @Gidi_Traffic @trafficbutter @lagostelevision @lagostraffic961,,1200093059658244097,https://twitter.com/followlastma/status/1200093059658244097,"RJ from Ilubirin inw OsborneRd to Dolphin is good, then slow to the alternation point. Steady flow inw AlfredRewane to Falomo r/a. Falomo r/a inw AwolowoRd is slow to OmoOsagie jxn."
2019-11-28 16:44:15,followlastma,,1,1,4,,@TrafficChiefNG @Gidi_Traffic @trafficbutter @lagostelevision @lagostraffic961,#Ikoyi #PMTrafficUpdate,1200093052616007680,https://twitter.com/followlastma/status/1200093052616007680,[5.40pm] CivicCentre inw RampBridge to FalomoBridge is busy. AkinAdesola inw FalomoBridge is slow. FalomoBridge inw AlfredRewane through OsborneRd to Ilubirin is very busy.
2019-11-28 16:27:37,followlastma,,0,0,0,,@TrafficChiefNG @Gidi_Traffic @trafficbutter @lagostelevision @lagostraffic961,,1200088867380121601,https://twitter.com/followlastma/status/1200088867380121601,Busy approaching NNPC to BonnyCamp. BonnyCamp to Checkpoint is busy then steady inw McWen.
2019-11-28 16:27:36,followlastma,,1,0,0,,@TrafficChiefNG @Gidi_Traffic @trafficbutter @lagostelevision @lagostraffic961,,1200088865387753472,https://twitter.com/followlastma/status/1200088865387753472,"Good movement inw the Tollplaza, though slow at the Tollplaza. Tollplaza inw Sandfill to CivicCentre is ok. CivicCentre inw LawSchool is slow. LawSchool to LagoonRestaurant is good."
2019-11-28 16:27:36,followlastma,,1,0,0,,@TrafficChiefNG @Gidi_Traffic @trafficbutter @lagostelevision @lagostraffic961,,1200088863617802241,https://twitter.com/followlastma/status/1200088863617802241,"Tollplaza to Lekki r/a is ok, though slow at the r/a. A bit better after the r/a but very busy inw Marwa r/a. RJ from Marwa r/a inw Lekki r/a is ok, though slow at the r/a."
2019-11-28 16:27:35,followlastma,,1,0,0,,@TrafficChiefNG @Gidi_Traffic @trafficbutter @lagostelevision @lagostraffic961,,1200088861214433280,https://twitter.com/followlastma/status/1200088861214433280,"Good movement to Carwash, slow to LawSchool. LawSchool inw 1stGate is steady. Slow inw 2ndGate to Sandfill. Sandfill inw the Tollplaza is steady but slow at the Tollplaza."
2019-11-28 16:27:35,followlastma,,1,0,0,,@TrafficChiefNG @Gidi_Traffic @trafficbutter @lagostelevision,,1200088858798567425,https://twitter.com/followlastma/status/1200088858798567425,EkoHotel r/a inw SanusiFafunwa to AkinAdesola is steady. EkoHotel r/a inw AhmaduBelloWay is very good. Slow approaching AdeolaOdeku jxn. Steady inw BonnyCamp. BonnyCamp inw OzumbaMbadiwe is steady to KofoAbayomi jxn.
2019-11-28 16:27:34,followlastma,,1,0,0,,@TrafficChiefNG @Gidi_Traffic @trafficbutter @lagostelevision,,1200088856386850821,https://twitter.com/followlastma/status/1200088856386850821,"Better movement on the RJ back inw AjoseAdeogun to PatienceCoker jxn, then slow to EkoHotel r/a. EkoHotel r/a inw AdetokunboAdemola to CivicCentre is good. RJ is good to BishopAboyadeCole jxn, then slow to EkoHotel r/a"
2019-11-28 16:27:21,followlastma,,1,0,0,,@TrafficChiefNG @Gidi_Traffic @trafficbutter @lagostelevision @lagostraffic961,,1200088800015372288,https://twitter.com/followlastma/status/1200088800015372288,Movement approaching EkoHotel Gate to EkoHotel r/a is busy. EkoHotel r/a inw AjoseAdeogun to LigaliAyorinde is very good. Movement along LogaliAyorinde inw WaterCorporation is slow.
2019-11-28 16:27:20,followlastma,,1,1,2,,@TrafficChiefNG @Gidi_Traffic @trafficbutter @lagostelevision @lagostraffic961,#VI #PMTrafficUpdate,1200088797481963520,https://twitter.com/followlastma/status/1200088797481963520,"[5.21pm] McWen bridge inw BonnyCamp is very good. BonnyCamp inw AhmaduBelloWay is very GTG to Oceanview, though a bit slow at various alternation points."
2019-11-28 16:03:09,followlastma,,0,0,0,,@TrafficChiefNG @Gidi_Traffic @trafficbutter @lagostelevision @lagostraffic961,,1200082711978926081,https://twitter.com/followlastma/status/1200082711978926081,There is a brokendown truck reported at Oando. Movement inw Alapere down to Otedola is GTG. Slow movement approaching Berger due to traffic connecting Berger UBridge and Isheri. Berger inw Kara is ok.
2019-11-28 16:03:08,followlastma,,1,1,3,,@TrafficChiefNG @Gidi_Traffic @trafficbutter @lagostelevision @lagostraffic961,#3MB #LagosIbadanExp #PMTrafficUpdate,1200082707541364736,https://twitter.com/followlastma/status/1200082707541364736,[4.58pm] Obalende and OsborneRd inw Ilubirin is busy. Ilubirin inw Adenji down to IyanaOworo is very GTG. Movement inw Olopomeji to Oando is busy.
2019-11-28 14:07:28,followlastma,,2,5,7,,@TrafficChiefNG @Gidi_Traffic @trafficbutter @lagostelevision @lagostraffic961pic,#AgegeMotorRd #lastmareports,1200053597104431105,https://twitter.com/followlastma/status/1200053597104431105,[3.00pm] This mixer is working on the open holes around Airport UBridge thereby causing traffic backlog to AjayiFarm. Officers are on ground managing the traffic situation.
2019-11-28 12:56:19,followlastma,,0,3,0,,@LAG_FireService @TrafficChiefNG @Gidi_Traffic @trafficbutter @lagostelevision @lagostraffic961,#Ikeja #lastmareports,1200035691540963328,https://twitter.com/followlastma/status/1200035691540963328,[1.52pm] Burning car on IkejaBridge inw Kodesoh causing traffic backlog to GTB on ObaAkran. Men of already enroute. Please be patient.
2019-11-28 11:42:01,followlastma,,0,2,1,,@LSPWC_Official,#Fagba #lastmareports,1200016996563374082,https://twitter.com/followlastma/status/1200016996563374082,"[12.40pm] working around AbiodunKuyeRd and Olayiwola with OlaniyiRd now cordoned off. So those moving from Fagba towards JonathanCoker have now been diverted after the railway crossing through Abattoir, OkoOba towards AbuleEgba."
2019-11-28 07:54:20,followlastma,,0,1,0,,@TrafficChiefNG @Gidi_Traffic @trafficbutter @lagostelevision @lagostraffic961,#IkoroduRd #AMTrafficReview,1199959696876199936,https://twitter.com/followlastma/status/1199959696876199936,[8.53am] Movement from Ikorodu down t o Mile12 is now very good. Slow from Mile12 Bridge to Kosofe. Kosofe to the Interchange is very good.
